1,1,"In the past God spoke to our ancestors through the prophets at many times and in various ways,"
1,2,"but in these last days he has spoken to us by his Son, whom he appointed heir of all things, and through whom also he made the universe."
1,3,"The Son is the radiance of God’s glory and the exact representation of his being, sustaining all things by his powerful word. After he had provided purification for sins, he sat down at the right hand of the Majesty in heaven."
1,4,"So he became as much superior to the angels as the name he has inherited is superior to theirs."
1,5,"For to which of the angels did God ever say, “You are my Son; today I have become your Father”? Or again, “I will be his Father, and he will be my Son”?"
1,6,"And again, when God brings his firstborn into the world, he says, “Let all God’s angels worship him.”"
1,7,"In speaking of the angels he says, “He makes his angels spirits, and his servants flames of fire.”"
1,8,"But about the Son he says, “Your throne, O God, will last for ever and ever; a scepter of justice will be the scepter of your kingdom."
1,9,"You have loved righteousness and hated wickedness; therefore God, your God, has set you above your companions by anointing you with the oil of joy.”"
1,10,"He also says, “In the beginning, Lord, you laid the foundations of the earth, and the heavens are the work of your hands."
1,11,"They will perish, but you remain; they will all wear out like a garment."
1,12,"You will roll them up like a robe; like a garment they will be changed. But you remain the same, and your years will never end.”"
1,13,"To which of the angels did God ever say, “Sit at my right hand until I make your enemies a footstool for your feet”?"
1,14,"Are not all angels ministering spirits sent to serve those who will inherit salvation?"
2,1,"We must pay the most careful attention, therefore, to what we have heard, so that we do not drift away."
2,2,"For since the message spoken through angels was binding, and every violation and disobedience received its just punishment,"
2,3,"how shall we escape if we ignore so great a salvation? This salvation, which was first announced by the Lord, was confirmed to us by those who heard him."
2,4,"God also testified to it by signs, wonders and various miracles, and by gifts of the Holy Spirit distributed according to his will."
2,5,"It is not to angels that he has subjected the world to come, about which we are speaking."
2,6,"But there is a place where someone has testified: “What is mankind that you are mindful of them, a son of man that you care for him?"
2,7,"You made them a little lower than the angels; you crowned them with glory and honor"
2,8,"and put everything under their feet.” In putting everything under them, God left nothing that is not subject to them. Yet at present we do not see everything subject to them."
2,9,"But we do see Jesus, who was made lower than the angels for a little while, now crowned with glory and honor because he suffered death, so that by the grace of God he might taste death for everyone."
2,10,"In bringing many sons and daughters to glory, it was fitting that God, for whom and through whom everything exists, should make the pioneer of their salvation perfect through what he suffered."
2,11,"Both the one who makes people holy and those who are made holy are of the same family. So Jesus is not ashamed to call them brothers and sisters."
2,12,"He says, “I will declare your name to my brothers and sisters; in the assembly I will sing your praises.”"
2,13,"And again, “I will put my trust in him.” And again he says, “Here am I, and the children God has given me.”"
2,14,"Since the children have flesh and blood, he too shared in their humanity so that by his death he might break the power of him who holds the power of death—that is, the devil—"
2,15,"and free those who all their lives were held in slavery by their fear of death."
2,16,"For surely it is not angels he helps, but Abraham’s descendants."
2,17,"For this reason he had to be made like them, fully human in every way, in order that he might become a merciful and faithful high priest in service to God, and that he might make atonement for the sins of the people."
2,18,"Because he himself suffered when he was tempted, he is able to help those who are being tempted."
3,1,"Therefore, holy brothers and sisters, who share in the heavenly calling, fix your thoughts on Jesus, whom we acknowledge as our apostle and high priest."
3,2,"He was faithful to the one who appointed him, just as Moses was faithful in all God’s house."
3,3,"Jesus has been found worthy of greater honor than Moses, just as the builder of a house has greater honor than the house itself."
3,4,"For every house is built by someone, but God is the builder of everything."
3,5,"“Moses was faithful as a servant in all God’s house,” bearing witness to what would be spoken by God in the future."
3,6,"But Christ is faithful as the Son over God’s house. And we are his house, if indeed we hold firmly to our confidence and the hope in which we glory."
3,7,"So, as the Holy Spirit says: “Today, if you hear his voice,"
3,8,"do not harden your hearts as you did in the rebellion, during the time of testing in the wilderness,"
3,9,"where your ancestors tested and tried me, though for forty years they saw what I did."
3,10,"That is why I was angry with that generation; I said, ‘Their hearts are always going astray, and they have not known my ways.’"
3,11,"So I declared on oath in my anger, ‘They shall never enter my rest.’ ”"
3,12,"See to it, brothers and sisters, that none of you has a sinful, unbelieving heart that turns away from the living God."
3,13,"But encourage one another daily, as long as it is called “Today,” so that none of you may be hardened by sin’s deceitfulness."
3,14,"We have come to share in Christ, if indeed we hold our original conviction firmly to the very end."
3,15,"As has just been said: “Today, if you hear his voice, do not harden your hearts as you did in the rebellion.”"
3,16,"Who were they who heard and rebelled? Were they not all those Moses led out of Egypt?"
3,17,"And with whom was he angry for forty years? Was it not with those who sinned, whose bodies perished in the wilderness?"
3,18,"And to whom did God swear that they would never enter his rest if not to those who disobeyed?"
3,19,"So we see that they were not able to enter, because of their unbelief."
4,1,"Therefore, since the promise of entering his rest still stands, let us be careful that none of you be found to have fallen short of it."
4,2,"For we also have had the good news proclaimed to us, just as they did; but the message they heard was of no value to them, because they did not share the faith of those who obeyed."
4,3,"Now we who have believed enter that rest, just as God has said, “So I declared on oath in my anger, ‘They shall never enter my rest.’” And yet his works have been finished since the creation of the world."
4,4,"For somewhere he has spoken about the seventh day in these words: “On the seventh day God rested from all his works.”"
4,5,"And again in the passage above he says, “They shall never enter my rest.”"
4,6,"Therefore since it still remains for some to enter that rest, and since those who formerly had the good news proclaimed to them did not go in because of their disobedience,"
4,7,"God again set a certain day, calling it “Today.” This he did when a long time later he spoke through David, as in the passage already quoted: “Today, if you hear his voice, do not harden your hearts.”"
4,8,"For if Joshua had given them rest, God would not have spoken later about another day."
4,9,"There remains, then, a Sabbath-rest for the people of God;"
4,10,"for anyone who enters God’s rest also rests from their works, just as God did from his."
4,11,"Let us, therefore, make every effort to enter that rest, so that no one will perish by following their example of disobedience."
4,12,"For the word of God is alive and active. Sharper than any double-edged sword, it penetrates even to dividing soul and spirit, joints and marrow; it judges the thoughts and attitudes of the heart."
4,13,"Nothing in all creation is hidden from God’s sight. Everything is uncovered and laid bare before the eyes of him to whom we must give account."
4,14,"Therefore, since we have a great high priest who has ascended into heaven, Jesus the Son of God, let us hold firmly to the faith we profess."
4,15,"For we do not have a high priest who is unable to empathize with our weaknesses, but we have one who has been tempted in every way, just as we are—yet he did not sin."
4,16,"Let us then approach God’s throne of grace with confidence, so that we may receive mercy and find grace to help us in our time of need."
5,1,"Every high priest is selected from among the people and is appointed to represent the people in matters related to God, to offer gifts and sacrifices for sins."
5,2,"He is able to deal gently with those who are ignorant and are going astray, since he himself is subject to weakness."
5,3,"This is why he has to offer sacrifices for his own sins, as well as for the sins of the people."
5,4,"And no one takes this honor on himself, but he receives it when called by God, just as Aaron was."
5,5,"In the same way, Christ did not take on himself the glory of becoming a high priest. But God said to him, “You are my Son; today I have become your Father.”"
5,6,"And he says in another place, “You are a priest forever, in the order of Melchizedek.”"
5,7,"During the days of Jesus’ life on earth, he offered up prayers and petitions with fervent cries and tears to the one who could save him from death, and he was heard because of his reverent submission."
5,8,"Son though he was, he learned obedience from what he suffered"
5,9,"and, once made perfect, he became the source of eternal salvation for all who obey him"
5,10,"and was designated by God to be high priest in the order of Melchizedek."
5,11,"We have much to say about this, but it is hard to make it clear to you because you no longer try to understand."
5,12,"In fact, though by this time you ought to be teachers, you need someone to teach you the elementary truths of God’s word all over again. You need milk, not solid food!"
5,13,"Anyone who lives on milk, being still an infant, is not acquainted with the teaching about righteousness."
5,14,"But solid food is for the mature, who by constant use have trained themselves to distinguish good from evil."
6,1,"Therefore let us move beyond the elementary teachings about Christ and be taken forward to maturity, not laying again the foundation of repentance from acts that lead to death, and of faith in God,"
6,2,"instruction about cleansing rites, the laying on of hands, the resurrection of the dead, and eternal judgment."
6,3,"And God permitting, we will do so."
6,4,"It is impossible for those who have once been enlightened, who have tasted the heavenly gift, who have shared in the Holy Spirit,"
6,5,"who have tasted the goodness of the word of God and the powers of the coming age"
6,6,"and who have fallen away, to be brought back to repentance. To their loss they are crucifying the Son of God all over again and subjecting him to public disgrace."
6,7,"Land that drinks in the rain often falling on it and that produces a crop useful to those for whom it is farmed receives the blessing of God."
6,8,"But land that produces thorns and thistles is worthless and is in danger of being cursed. In the end it will be burned."
6,9,"Even though we speak like this, dear friends, we are convinced of better things in your case—the things that have to do with salvation."
6,10,"God is not unjust; he will not forget your work and the love you have shown him as you have helped his people and continue to help them."
6,11,"We want each of you to show this same diligence to the very end, so that what you hope for may be fully realized."
6,12,"We do not want you to become lazy, but to imitate those who through faith and patience inherit what has been promised."
6,13,"When God made his promise to Abraham, since there was no one greater for him to swear by, he swore by himself,"
6,14,"saying, “I will surely bless you and give you many descendants.”"
6,15,"And so after waiting patiently, Abraham received what was promised."
6,16,"People swear by someone greater than themselves, and the oath confirms what is said and puts an end to all argument."
6,17,"Because God wanted to make the unchanging nature of his purpose very clear to the heirs of what was promised, he confirmed it with an oath."
6,18,"God did this so that, by two unchangeable things in which it is impossible for God to lie, we who have fled to take hold of the hope set before us may be greatly encouraged."
6,19,"We have this hope as an anchor for the soul, firm and secure. It enters the inner sanctuary behind the curtain,"
6,20,"where our forerunner, Jesus, has entered on our behalf. He has become a high priest forever, in the order of Melchizedek."
7,1,"This Melchizedek was king of Salem and priest of God Most High. He met Abraham returning from the defeat of the kings and blessed him,"
7,2,"and Abraham gave him a tenth of everything. First, the name Melchizedek means “king of righteousness”; then also, “king of Salem” means “king of peace.”"
7,3,"Without father or mother, without genealogy, without beginning of days or end of life, resembling the Son of God, he remains a priest forever."
7,4,"Just think how great he was: Even the patriarch Abraham gave him a tenth of the plunder!"
7,5,"Now the law requires the descendants of Levi who become priests to collect a tenth from the people—that is, from their fellow Israelites—even though they also are descended from Abraham."
7,6,"This man, however, did not trace his descent from Levi, yet he collected a tenth from Abraham and blessed him who had the promises."
7,7,"And without doubt the lesser is blessed by the greater."
7,8,"In the one case, the tenth is collected by people who die; but in the other case, by him who is declared to be living."
7,9,"One might even say that Levi, who collects the tenth, paid the tenth through Abraham,"
7,10,"because when Melchizedek met Abraham, Levi was still in the body of his ancestor."
7,11,"If perfection could have been attained through the Levitical priesthood—and indeed the law given to the people established that priesthood—why was there still need for another priest to come, one in the order of Melchizedek, not in the order of Aaron?"
7,12,"For when the priesthood is changed, the law must be changed also."
7,13,"He of whom these things are said belonged to a different tribe, and no one from that tribe has ever served at the altar."
7,14,"For it is clear that our Lord descended from Judah, and in regard to that tribe Moses said nothing about priests."
7,15,"And what we have said is even more clear if another priest like Melchizedek appears,"
7,16,"one who has become a priest not on the basis of a regulation as to his ancestry but on the basis of the power of an indestructible life."
7,17,"For it is declared: “You are a priest forever, in the order of Melchizedek.”"
7,18,"The former regulation is set aside because it was weak and useless"
7,19,"(for the law made nothing perfect), and a better hope is introduced, by which we draw near to God."
7,20,"And it was not without an oath! Others became priests without any oath,"
7,21,"but he became a priest with an oath when God said to him: “The Lord has sworn and will not change his mind: ‘You are a priest forever.’”"
7,22,"Because of this oath, Jesus has become the guarantor of a better covenant."
7,23,"Now there have been many of those priests, since death prevented them from continuing in office;"
7,24,"but because Jesus lives forever, he has a permanent priesthood."
7,25,"Therefore he is able to save completely those who come to God through him, because he always lives to intercede for them."
7,26,"Such a high priest truly meets our need—one who is holy, blameless, pure, set apart from sinners, exalted above the heavens."
7,27,"Unlike the other high priests, he does not need to offer sacrifices day after day, first for his own sins, and then for the sins of the people. He sacrificed for their sins once for all when he offered himself."
7,28,"For the law appoints as high priests men in all their weakness; but the oath, which came after the law, appointed the Son, who has been made perfect forever."
8,1,"Now the main point of what we are saying is this: We do have such a high priest, who sat down at the right hand of the throne of the Majesty in heaven,"
8,2,"and who serves in the sanctuary, the true tabernacle set up by the Lord, not by a mere human being."
8,3,"Every high priest is appointed to offer both gifts and sacrifices, and so it was necessary for this one also to have something to offer."
8,4,"If he were on earth, he would not be a priest, for there are already priests who offer the gifts prescribed by the law."
8,5,"They serve at a sanctuary that is a copy and shadow of what is in heaven. This is why Moses was warned when he was about to build the tabernacle: “See to it that you make everything according to the pattern shown you on the mountain.”"
8,6,"But in fact the ministry Jesus has received is as superior to theirs as the covenant of which he is mediator is superior to the old one, since the new covenant is established on better promises."
8,7,"For if there had been nothing wrong with that first covenant, no place would have been sought for another."
8,8,"But God found fault with the people and said: “The days are coming, declares the Lord, when I will make a new covenant with the people of Israel and with the people of Judah."
8,9,"It will not be like the covenant I made with their ancestors when I took them by the hand to lead them out of Egypt, because they did not remain faithful to my covenant, and I turned away from them, declares the Lord."
8,10,"This is the covenant I will establish with the people of Israel after that time, declares the Lord. I will put my laws in their minds and write them on their hearts. I will be their God, and they will be my people."
8,11,"No longer will they teach their neighbor, or say to one another, ‘Know the Lord,’ because they will all know me, from the least of them to the greatest."
8,12,"For I will forgive their wickedness and will remember their sins no more.”"
8,13,"By calling this covenant “new,” he has made the first one obsolete; and what is obsolete and outdated will soon disappear."
9,1,"Now the first covenant had regulations for worship and also an earthly sanctuary."
9,2,"A tabernacle was set up. In its first room were the lampstand and the table with its consecrated bread; this was called the Holy Place."
9,3,"Behind the second curtain was a room called the Most Holy Place,"
9,4,"which had the golden altar of incense and the gold-covered ark of the covenant. This ark contained the gold jar of manna, Aaron’s staff that had budded, and the stone tablets of the covenant."
9,5,"Above the ark were the cherubim of the Glory, overshadowing the atonement cover. But we cannot discuss these things in detail now."
9,6,"When everything had been arranged like this, the priests entered regularly into the outer room to carry on their ministry."
9,7,"But only the high priest entered the inner room, and that only once a year, and never without blood, which he offered for himself and for the sins the people had committed in ignorance."
9,8,"The Holy Spirit was showing by this that the way into the Most Holy Place had not yet been disclosed as long as the first tabernacle was still functioning."
9,9,"This is an illustration for the present time, indicating that the gifts and sacrifices being offered were not able to clear the conscience of the worshiper."
9,10,"They are only a matter of food and drink and various ceremonial washings—external regulations applying until the time of the new order."
9,11,"But when Christ came as high priest of the good things that are now already here, he went through the greater and more perfect tabernacle that is not made with human hands, that is to say, is not a part of this creation."
9,12,"He did not enter by means of the blood of goats and calves; but he entered the Most Holy Place once for all by his own blood, thus obtaining eternal redemption."
9,13,"The blood of goats and bulls and the ashes of a heifer sprinkled on those who are ceremonially unclean sanctify them so that they are outwardly clean."
9,14,"How much more, then, will the blood of Christ, who through the eternal Spirit offered himself unblemished to God, cleanse our consciences from acts that lead to death, so that we may serve the living God!"
9,15,"For this reason Christ is the mediator of a new covenant, that those who are called may receive the promised eternal inheritance—now that he has died as a ransom to set them free from the sins committed under the first covenant."
9,16,"In the case of a will, it is necessary to prove the death of the one who made it,"
9,17,"because a will is in force only when somebody has died; it never takes effect while the one who made it is living."
9,18,"This is why even the first covenant was not put into effect without blood."
9,19,"When Moses had proclaimed every command of the law to all the people, he took the blood of calves, together with water, scarlet wool and branches of hyssop, and sprinkled the scroll and all the people."
9,20,"He said, “This is the blood of the covenant, which God has commanded you to keep.”"
9,21,"In the same way, he sprinkled with the blood both the tabernacle and everything used in its ceremonies."
9,22,"In fact, the law requires that nearly everything be cleansed with blood, and without the shedding of blood there is no forgiveness."
9,23,"It was necessary, then, for the copies of the heavenly things to be purified with these sacrifices, but the heavenly things themselves with better sacrifices than these."
9,24,"For Christ did not enter a sanctuary made with human hands that was only a copy of the true one; he entered heaven itself, now to appear for us in God’s presence."
9,25,"Nor did he enter heaven to offer himself again and again, the way the high priest enters the Most Holy Place every year with blood that is not his own."
9,26,"Otherwise Christ would have had to suffer many times since the creation of the world. But he has appeared once for all at the culmination of the ages to do away with sin by the sacrifice of himself."
9,27,"Just as people are destined to die once, and after that to face judgment,"
9,28,"so Christ was sacrificed once to take away the sins of many; and he will appear a second time, not to bear sin, but to bring salvation to those who are waiting for him."
10,1,"The law is only a shadow of the good things that are coming—not the realities themselves. For this reason it can never, by the same sacrifices repeated endlessly year after year, make perfect those who draw near to worship."
10,2,"Otherwise, would they not have stopped being offered? For the worshipers would have been cleansed once for all, and would no longer have felt guilty for their sins."
10,3,"But those sacrifices are an annual reminder of sins."
10,4,"It is impossible for the blood of bulls and goats to take away sins."
10,5,"Therefore, when Christ came into the world, he said: “Sacrifice and offering you did not desire, but a body you prepared for me;"
10,6,"with burnt offerings and sin offerings you were not pleased."
10,7,"Then I said, ‘Here I am—it is written about me in the scroll— I have come to do your will, my God.’”"
10,8,"First he said, “Sacrifices and offerings, burnt offerings and sin offerings you did not desire, nor were you pleased with them”—though they were offered in accordance with the law."
10,9,"Then he said, “Here I am, I have come to do your will.” He sets aside the first to establish the second."
10,10,"And by that will, we have been made holy through the sacrifice of the body of Jesus Christ once for all."
10,11,"Day after day every priest stands and performs his religious duties; again and again he offers the same sacrifices, which can never take away sins."
10,12,"But when this priest had offered for all time one sacrifice for sins, he sat down at the right hand of God,"
10,13,"and since that time he waits for his enemies to be made his footstool."
10,14,"For by one sacrifice he has made perfect forever those who are being made holy."
10,15,"The Holy Spirit also testifies to us about this. First he says:"
10,16,"“This is the covenant I will make with them after that time, says the Lord. I will put my laws in their hearts, and I will write them on their minds.”"
10,17,"Then he adds: “Their sins and lawless acts I will remember no more.”"
10,18,"And where these have been forgiven, sacrifice for sin is no longer necessary."
10,19,"Therefore, brothers and sisters, since we have confidence to enter the Most Holy Place by the blood of Jesus,"
10,20,"by a new and living way opened for us through the curtain, that is, his body,"
10,21,"and since we have a great priest over the house of God,"
10,22,"let us draw near to God with a sincere heart and with the full assurance that faith brings, having our hearts sprinkled to cleanse us from a guilty conscience and having our bodies washed with pure water."
10,23,"Let us hold unswervingly to the hope we profess, for he who promised is faithful."
10,24,"And let us consider how we may spur one another on toward love and good deeds,"
10,25,"not giving up meeting together, as some are in the habit of doing, but encouraging one another—and all the more as you see the Day approaching."
