6,19,"When they had rowed about three or four miles, they saw Jesus approaching the boat, walking on the water; and they were frightened."
6,20,"But he said to them, “It is I; don’t be afraid.”"
6,21,"Then they were willing to take him into the boat, and immediately the boat reached the shore where they were heading."
6,22,"The next day the crowd that had stayed on the opposite shore of the lake realized that only one boat had been there, and that Jesus had not entered it with his disciples, but that they had gone away alone."
6,23,"Then some boats from Tiberias landed near the place where the people had eaten the bread after the Lord had given thanks."
6,24,"Once the crowd realized that neither Jesus nor his disciples were there, they got into the boats and went to Capernaum in search of Jesus."
6,25,"When they found him on the other side of the lake, they asked him, “Rabbi, when did you get here?”"
6,26,"Jesus answered, “Very truly I tell you, you are looking for me, not because you saw the signs I performed but because you ate the loaves and had your fill."
6,27,"Do not work for food that spoils, but for food that endures to eternal life, which the Son of Man will give you. For on him God the Father has placed his seal of approval.”"
6,28,"Then they asked him, “What must we do to do the works God requires?”"
6,29,"Jesus answered, “The work of God is this: to believe in the one he has sent.”"
6,30,"So they asked him, “What sign then will you give that we may see it and believe you? What will you do?"
6,31,"Our ancestors ate the manna in the wilderness; as it is written: ‘He gave them bread from heaven to eat.’”"
6,32,"Jesus said to them, “Very truly I tell you, it is not Moses who has given you the bread from heaven, but it is my Father who gives you the true bread from heaven."
6,33,"For the bread of God is the bread that comes down from heaven and gives life to the world.”"
6,34,"“Sir,” they said, “always give us this bread.”"
6,35,"Then Jesus declared, “I am the bread of life. Whoever comes to me will never go hungry, and whoever believes in me will never be thirsty."
6,36,"But as I told you, you have seen me and still you do not believe."
6,37,"All those the Father gives me will come to me, and whoever comes to me I will never drive away."
6,38,"For I have come down from heaven not to do my will but to do the will of him who sent me."
6,39,"And this is the will of him who sent me, that I shall lose none of all those he has given me, but raise them up at the last day."
6,40,"For my Father’s will is that everyone who looks to the Son and believes in him shall have eternal life, and I will raise them up at the last day.”"
6,41,"At this the Jews there began to grumble about him because he said, “I am the bread that came down from heaven.”"
6,42,"They said, “Is this not Jesus, the son of Joseph, whose father and mother we know? How can he now say, ‘I came down from heaven’?”"
6,43,"“Stop grumbling among yourselves,” Jesus answered."
6,44,"“No one can come to me unless the Father who sent me draws them, and I will raise them up at the last day."
6,45,"It is written in the Prophets: ‘They will all be taught by God.’ Everyone who has heard the Father and learned from him comes to me."
6,46,"No one has seen the Father except the one who is from God; only he has seen the Father."
6,47,"Very truly I tell you, the one who believes has eternal life."
6,48,"I am the bread of life."
6,49,"Your ancestors ate the manna in the wilderness, yet they died."
6,50,"But here is the bread that comes down from heaven, which anyone may eat and not die."
6,51,"I am the living bread that came down from heaven. Whoever eats this bread will live forever. This bread is my flesh, which I will give for the life of the world.”"
6,52,"Then the Jews began to argue sharply among themselves, “How can this man give us his flesh to eat?”"
6,53,"Jesus said to them, “Very truly I tell you, unless you eat the flesh of the Son of Man and drink his blood, you have no life in you."
6,54,"Whoever eats my flesh and drinks my blood has eternal life, and I will raise them up at the last day."
6,55,"For my flesh is real food and my blood is real drink."
6,56,"Whoever eats my flesh and drinks my blood remains in me, and I in them."
6,57,"Just as the living Father sent me and I live because of the Father, so the one who feeds on me will live because of me."
6,58,"This is the bread that came down from heaven. Your ancestors ate manna and died, but whoever feeds on this bread will live forever.”"
6,59,"He said this while teaching in the synagogue in Capernaum."
6,60,"On hearing it, many of his disciples said, “This is a hard teaching. Who can accept it?”"
6,61,"Aware that his disciples were grumbling about this, Jesus said to them, “Does this offend you?"
6,62,"Then what if you see the Son of Man ascend to where he was before!"
6,63,"The Spirit gives life; the flesh counts for nothing. The words I have spoken to you—they are full of the Spirit and life."
6,64,"Yet there are some of you who do not believe.” For Jesus had known from the beginning which of them did not believe and who would betray him."
6,65,"He went on to say, “This is why I told you that no one can come to me unless the Father has enabled them.”"
6,66,"From this time many of his disciples turned back and no longer followed him."
6,67,"“You do not want to leave too, do you?” Jesus asked the Twelve."
6,68,"Simon Peter answered him, “Lord, to whom shall we go? You have the words of eternal life."
6,69,"We have come to believe and to know that you are the Holy One of God.”"
6,70,"Then Jesus replied, “Have I not chosen you, the Twelve? Yet one of you is a devil!”"
6,71,"(He meant Judas, the son of Simon Iscariot, who, though one of the Twelve, was later to betray him.)"
7,1,"After this, Jesus went around in Galilee. He did not want to go about in Judea because the Jewish leaders there were looking for a way to kill him."
7,2,"But when the Jewish Festival of Tabernacles was near,"
7,3,"Jesus’ brothers said to him, “Leave Galilee and go to Judea, so that your disciples there may see the works you do."
7,4,"No one who wants to become a public figure acts in secret. Since you are doing these things, show yourself to the world.”"
7,5,"For even his own brothers did not believe in him."
7,6,"Therefore Jesus told them, “My time is not yet here; for you any time will do."
7,7,"The world cannot hate you, but it hates me because I testify that its works are evil."
7,8,"You go to the festival. I am not going up to this festival, because my time has not yet fully come.”"
7,9,"After he had said this, he stayed in Galilee."
7,10,"However, after his brothers had left for the festival, he went also, not publicly, but in secret."
7,11,"Now at the festival the Jewish leaders were watching for Jesus and asking, “Where is he?”"
7,12,"Among the crowds there was widespread whispering about him. Some said, “He is a good man.” Others replied, “No, he deceives the people.”"
7,13,"But no one would say anything publicly about him for fear of the leaders."
7,14,"Not until halfway through the festival did Jesus go up to the temple courts and begin to teach."
7,15,"The Jews there were amazed and asked, “How did this man get such learning without having been taught?”"
7,16,"Jesus answered, “My teaching is not my own. It comes from the one who sent me."
7,17,"Anyone who chooses to do the will of God will find out whether my teaching comes from God or whether I speak on my own."
7,18,"Whoever speaks on their own does so to gain personal glory, but he who seeks the glory of the one who sent him is a man of truth; there is nothing false about him."
7,19,"Has not Moses given you the law? Yet not one of you keeps the law. Why are you trying to kill me?”"
7,20,"“You are demon-possessed,” the crowd answered. “Who is trying to kill you?”"
7,21,"Jesus said to them, “I did one miracle, and you are all amazed."
7,22,"Yet, because Moses gave you circumcision (though actually it did not come from Moses, but from the patriarchs), you circumcise a boy on the Sabbath."
7,23,"Now if a boy can be circumcised on the Sabbath so that the law of Moses may not be broken, why are you angry with me for healing a man’s whole body on the Sabbath?"
7,24,"Stop judging by mere appearances, but instead judge correctly.”"
7,25,"At that point some of the people of Jerusalem began to ask, “Isn’t this the man they are trying to kill?"
7,26,"Here he is, speaking publicly, and they are not saying a word to him. Have the authorities really concluded that he is the Messiah?"
7,27,"But we know where this man is from; when the Messiah comes, no one will know where he is from.”"
7,28,"Then Jesus, still teaching in the temple courts, cried out, “Yes, you know me, and you know where I am from. I am not here on my own authority, but he who sent me is true. You do not know him,"
7,29,"but I know him because I am from him and he sent me.”"
7,30,"At this they tried to seize him, but no one laid a hand on him, because his hour had not yet come."
7,31,"Still, many in the crowd believed in him. They said, “When the Messiah comes, will he perform more signs than this man?”"
7,32,"The Pharisees heard the crowd whispering such things about him. Then the chief priests and the Pharisees sent temple guards to arrest him."
7,33,"Jesus said, “I am with you for only a short time, and then I am going to the one who sent me."
7,34,"You will look for me, but you will not find me; and where I am, you cannot come.”"
7,35,"The Jews said to one another, “Where does this man intend to go that we cannot find him? Will he go where our people live scattered among the Greeks, and teach the Greeks?"
7,36,"What did he mean when he said, ‘You will look for me, but you will not find me,’ and ‘Where I am, you cannot come’?”"
7,37,"On the last and greatest day of the festival, Jesus stood and said in a loud voice, “Let anyone who is thirsty come to me and drink."
7,38,"Whoever believes in me, as Scripture has said, rivers of living water will flow from within them.”"
7,39,"By this he meant the Spirit, whom those who believed in him were later to receive. Up to that time the Spirit had not been given, since Jesus had not yet been glorified."
7,40,"On hearing his words, some of the people said, “Surely this man is the Prophet.”"
7,41,"Others said, “He is the Messiah.” Still others asked, “How can the Messiah come from Galilee?"
7,42,"Does not Scripture say that the Messiah will come from David’s descendants and from Bethlehem, the town where David lived?”"
7,43,"Thus the people were divided because of Jesus."
7,44,"Some wanted to seize him, but no one laid a hand on him."
7,45,"Finally the temple guards went back to the chief priests and the Pharisees, who asked them, “Why didn’t you bring him in?”"
7,46,"“No one ever spoke the way this man does,” the guards replied."
7,47,"“You mean he has deceived you also?” the Pharisees retorted."
7,48,"“Have any of the rulers or of the Pharisees believed in him?"
7,49,"No! But this mob that knows nothing of the law—there is a curse on them.”"
7,50,"Nicodemus, who had gone to Jesus earlier and who was one of their own number, asked,"
7,51,"“Does our law condemn a man without first hearing him to find out what he has been doing?”"
7,52,"They replied, “Are you from Galilee, too? Look into it, and you will find that a prophet does not come out of Galilee.” "
7,53,"Then they all went home,"
8,1,"1 but Jesus went to the Mount of Olives."
8,2,"At dawn he appeared again in the temple courts, where all the people gathered around him, and he sat down to teach them."
8,3,"The teachers of the law and the Pharisees brought in a woman caught in adultery. They made her stand before the group"
8,4,"and said to Jesus, “Teacher, this woman was caught in the act of adultery."
8,5,"In the Law Moses commanded us to stone such women.Now what do you say?”"
8,6,"They were using this question as a trap,in order to have a basis for accusing him. But Jesus bent down and started to write on the ground with his finger."
8,7,"When they kept on questioning him, he straightened up and said to them, “Let any one of you who is without sin be the first to throw a stoneat her.”"
8,8,"Again he stooped down and wrote on the ground."
8,9,"At this, those who heard began to go away one at a time, the older ones first, until only Jesus was left, with the woman still standing there."
8,10,"Jesus straightened up and asked her, “Woman, where are they? Has no one condemned you?”"
8,11,"“No one, sir,” she said. “Then neither do I condemn you,”Jesus declared. “Go now and leave your life of sin.”"
8,12,"When Jesus spoke again to the people, he said, “I am the light of the world. Whoever follows me will never walk in darkness, but will have the light of life.”"
8,13,"The Pharisees challenged him, “Here you are, appearing as your own witness; your testimony is not valid.”"
8,14,"Jesus answered, “Even if I testify on my own behalf, my testimony is valid, for I know where I came from and where I am going. But you have no idea where I come from or where I am going."
8,15,"You judge by human standards; I pass judgment on no one."
8,16,"But if I do judge, my decisions are true, because I am not alone. I stand with the Father, who sent me."
8,17,"In your own Law it is written that the testimony of two witnesses is true."
8,18,"I am one who testifies for myself; my other witness is the Father, who sent me.”"
8,19,"Then they asked him, “Where is your father?” “You do not know me or my Father,” Jesus replied. “If you knew me, you would know my Father also.”"
8,20,"He spoke these words while teaching in the temple courts near the place where the offerings were put. Yet no one seized him, because his hour had not yet come."
8,21,"Once more Jesus said to them, “I am going away, and you will look for me, and you will die in your sin. Where I go, you cannot come.”"
8,22,"This made the Jews ask, “Will he kill himself? Is that why he says, ‘Where I go, you cannot come’?”"
8,23,"But he continued, “You are from below; I am from above. You are of this world; I am not of this world."
8,24,"I told you that you would die in your sins; if you do not believe that I am he, you will indeed die in your sins.”"
8,25,"“Who are you?” they asked. “Just what I have been telling you from the beginning,” Jesus replied."
8,26,"“I have much to say in judgment of you. But he who sent me is trustworthy, and what I have heard from him I tell the world.”"
8,27,"They did not understand that he was telling them about his Father."
8,28,"So Jesus said, “When you have lifted up the Son of Man, then you will know that I am he and that I do nothing on my own but speak just what the Father has taught me."
8,29,"The one who sent me is with me; he has not left me alone, for I always do what pleases him.”"
8,30,"Even as he spoke, many believed in him."
8,31,"To the Jews who had believed him, Jesus said, “If you hold to my teaching, you are really my disciples."
8,32,"Then you will know the truth, and the truth will set you free.”"
8,33,"They answered him, “We are Abraham’s descendants and have never been slaves of anyone. How can you say that we shall be set free?”"
8,34,"Jesus replied, “Very truly I tell you, everyone who sins is a slave to sin."
8,35,"Now a slave has no permanent place in the family, but a son belongs to it forever."
8,36,"So if the Son sets you free, you will be free indeed."
8,37,"I know that you are Abraham’s descendants. Yet you are looking for a way to kill me, because you have no room for my word."
8,38,"I am telling you what I have seen in the Father’s presence, and you are doing what you have heard from your father.”"
8,39,"“Abraham is our father,” they answered. “If you were Abraham’s children,” said Jesus, “then you would do what Abraham did."
8,40,"As it is, you are looking for a way to kill me, a man who has told you the truth that I heard from God. Abraham did not do such things."
8,41,"You are doing the works of your own father.” “We are not illegitimate children,” they protested. “The only Father we have is God himself.”"
8,42,"Jesus said to them, “If God were your Father, you would love me, for I have come here from God. I have not come on my own; God sent me."
8,43,"Why is my language not clear to you? Because you are unable to hear what I say."
8,44,"You belong to your father, the devil, and you want to carry out your father’s desires. He was a murderer from the beginning, not holding to the truth, for there is no truth in him. When he lies, he speaks his native language, for he is a liar and the father of lies."
8,45,"Yet because I tell the truth, you do not believe me!"
8,46,"Can any of you prove me guilty of sin? If I am telling the truth, why don’t you believe me?"
8,47,"Whoever belongs to God hears what God says. The reason you do not hear is that you do not belong to God.”"
8,48,"The Jews answered him, “Aren’t we right in saying that you are a Samaritan and demon-possessed?”"
8,49,"“I am not possessed by a demon,” said Jesus, “but I honor my Father and you dishonor me."
8,50,"I am not seeking glory for myself; but there is one who seeks it, and he is the judge."
8,51,"Very truly I tell you, whoever obeys my word will never see death.”"
8,52,"At this they exclaimed, “Now we know that you are demon-possessed! Abraham died and so did the prophets, yet you say that whoever obeys your word will never taste death."
8,53,"Are you greater than our father Abraham? He died, and so did the prophets. Who do you think you are?”"
8,54,"Jesus replied, “If I glorify myself, my glory means nothing. My Father, whom you claim as your God, is the one who glorifies me."
8,55,"Though you do not know him, I know him. If I said I did not, I would be a liar like you, but I do know him and obey his word."
8,56,"Your father Abraham rejoiced at the thought of seeing my day; he saw it and was glad.”"
8,57,"“You are not yet fifty years old,” they said to him, “and you have seen Abraham!”"
8,58,"“Very truly I tell you,” Jesus answered, “before Abraham was born, I am!”"
8,59,"At this, they picked up stones to stone him, but Jesus hid himself, slipping away from the temple grounds."
9,1,"As he went along, he saw a man blind from birth."
9,2,"His disciples asked him, “Rabbi, who sinned, this man or his parents, that he was born blind?”"
9,3,"“Neither this man nor his parents sinned,” said Jesus, “but this happened so that the works of God might be displayed in him."
9,4,"As long as it is day, we must do the works of him who sent me. Night is coming, when no one can work."
9,5,"While I am in the world, I am the light of the world.”"
9,6,"After saying this, he spit on the ground, made some mud with the saliva, and put it on the man’s eyes."
9,7,"“Go,” he told him, “wash in the Pool of Siloam” (this word means “Sent”). So the man went and washed, and came home seeing."
9,8,"His neighbors and those who had formerly seen him begging asked, “Isn’t this the same man who used to sit and beg?”"
9,9,"Some claimed that he was. Others said, “No, he only looks like him.” But he himself insisted, “I am the man.”"
9,10,"“How then were your eyes opened?” they asked."
9,11,"He replied, “The man they call Jesus made some mud and put it on my eyes. He told me to go to Siloam and wash. So I went and washed, and then I could see.”"
9,12,"“Where is this man?” they asked him. “I don’t know,” he said."
9,13,"They brought to the Pharisees the man who had been blind."
9,14,"Now the day on which Jesus had made the mud and opened the man’s eyes was a Sabbath."
9,15,"Therefore the Pharisees also asked him how he had received his sight. “He put mud on my eyes,” the man replied, “and I washed, and now I see.”"
9,16,"Some of the Pharisees said, “This man is not from God, for he does not keep the Sabbath.” But others asked, “How can a sinner perform such signs?” So they were divided."
9,17,"Then they turned again to the blind man, “What have you to say about him? It was your eyes he opened.” The man replied, “He is a prophet.”"
9,18,"They still did not believe that he had been blind and had received his sight until they sent for the man’s parents."
9,19,"“Is this your son?” they asked. “Is this the one you say was born blind? How is it that now he can see?”"
9,20,"“We know he is our son,” the parents answered, “and we know he was born blind."
9,21,"But how he can see now, or who opened his eyes, we don’t know. Ask him. He is of age; he will speak for himself.”"
9,22,"His parents said this because they were afraid of the Jewish leaders, who already had decided that anyone who acknowledged that Jesus was the Messiah would be put out of the synagogue."
9,23,"That was why his parents said, “He is of age; ask him.”"
9,24,"A second time they summoned the man who had been blind. “Give glory to God by telling the truth,” they said. “We know this man is a sinner.”"
9,25,"He replied, “Whether he is a sinner or not, I don’t know. One thing I do know. I was blind but now I see!”"
9,26,"Then they asked him, “What did he do to you? How did he open your eyes?”"
9,27,"He answered, “I have told you already and you did not listen. Why do you want to hear it again? Do you want to become his disciples too?”"
9,28,"Then they hurled insults at him and said, “You are this fellow’s disciple! We are disciples of Moses!"
9,29,"We know that God spoke to Moses, but as for this fellow, we don’t even know where he comes from.”"
9,30,"The man answered, “Now that is remarkable! You don’t know where he comes from, yet he opened my eyes."
9,31,"We know that God does not listen to sinners. He listens to the godly person who does his will."
9,32,"Nobody has ever heard of opening the eyes of a man born blind."
9,33,"If this man were not from God, he could do nothing.”"
9,34,"To this they replied, “You were steeped in sin at birth; how dare you lecture us!” And they threw him out."
9,35,"Jesus heard that they had thrown him out, and when he found him, he said, “Do you believe in the Son of Man?”"
9,36,"“Who is he, sir?” the man asked. “Tell me so that I may believe in him.”"
9,37,"Jesus said, “You have now seen him; in fact, he is the one speaking with you.”"
9,38,"Then the man said, “Lord, I believe,” and he worshiped him."
9,39,"Jesus said,“For judgment I have come into this world, so that the blind will see and those who see will become blind.”"
9,40,"Some Pharisees who were with him heard him say this and asked, “What? Are we blind too?”"
9,41,"Jesus said, “If you were blind, you would not be guilty of sin; but now that you claim you can see, your guilt remains."
10,1,"“Very truly I tell you Pharisees, anyone who does not enter the sheep pen by the gate, but climbs in by some other way, is a thief and a robber."
10,2,"The one who enters by the gate is the shepherd of the sheep."
10,3,"The gatekeeper opens the gate for him, and the sheep listen to his voice. He calls his own sheep by name and leads them out."
10,4,"When he has brought out all his own, he goes on ahead of them, and his sheep follow him because they know his voice."
10,5,"But they will never follow a stranger; in fact, they will run away from him because they do not recognize a stranger’s voice.”"
10,6,"Jesus used this figure of speech, but the Pharisees did not understand what he was telling them."
10,7,"Therefore Jesus said again, “Very truly I tell you, I am the gate for the sheep."
10,8,"All who have come before me are thieves and robbers, but the sheep have not listened to them."
10,9,"I am the gate; whoever enters through me will be saved. They will come in and go out, and find pasture."
10,10,"The thief comes only to steal and kill and destroy; I have come that they may have life, and have it to the full."
10,11,"“I am the good shepherd. The good shepherd lays down his life for the sheep."
10,12,"The hired hand is not the shepherd and does not own the sheep. So when he sees the wolf coming, he abandons the sheep and runs away. Then the wolf attacks the flock and scatters it."
10,13,"The man runs away because he is a hired hand and cares nothing for the sheep."
10,14,"“I am the good shepherd; I know my sheep and my sheep know me—"
10,15,"just as the Father knows me and I know the Father—and I lay down my life for the sheep."
10,16,"I have other sheep that are not of this sheep pen. I must bring them also. They too will listen to my voice, and there shall be one flock and one shepherd."
10,17,"The reason my Father loves me is that I lay down my life—only to take it up again."
10,18,"No one takes it from me, but I lay it down of my own accord. I have authority to lay it down and authority to take it up again. This command I received from my Father.”"
10,19,"The Jews who heard these words were again divided."
10,20,"Many of them said, “He is demon-possessed and raving mad. Why listen to him?”"
10,21,"But others said, “These are not the sayings of a man possessed by a demon. Can a demon open the eyes of the blind?”"
10,22,"Then came the Festival of Dedication at Jerusalem. It was winter,"
10,23,"and Jesus was in the temple courts walking in Solomon’s Colonnade."
10,24,"The Jews who were there gathered around him, saying, “How long will you keep us in suspense? If you are the Messiah, tell us plainly.”"
10,25,"Jesus answered, “I did tell you, but you do not believe. The works I do in my Father’s name testify about me,"
