10,26,"If we deliberately keep on sinning after we have received the knowledge of the truth, no sacrifice for sins is left,"
10,27,"but only a fearful expectation of judgment and of raging fire that will consume the enemies of God."
10,28,"Anyone who rejected the law of Moses died without mercy on the testimony of two or three witnesses."
10,29,"How much more severely do you think someone deserves to be punished who has trampled the Son of God underfoot, who has treated as an unholy thing the blood of the covenant that sanctified them, and who has insulted the Spirit of grace?"
10,30,"For we know him who said, “It is mine to avenge; I will repay,” and again, “The Lord will judge his people.”"
10,31,"It is a dreadful thing to fall into the hands of the living God."
10,32,"Remember those earlier days after you had received the light, when you endured in a great conflict full of suffering."
10,33,"Sometimes you were publicly exposed to insult and persecution; at other times you stood side by side with those who were so treated."
10,34,"You suffered along with those in prison and joyfully accepted the confiscation of your property, because you knew that you yourselves had better and lasting possessions."
10,35,"So do not throw away your confidence; it will be richly rewarded."
10,36,"You need to persevere so that when you have done the will of God, you will receive what he has promised."
10,37,"For, “In just a little while, he who is coming will come and will not delay.”"
10,38,"And, “But my righteous one will live by faith. And I take no pleasure in the one who shrinks back.”"
10,39,"But we do not belong to those who shrink back and are destroyed, but to those who have faith and are saved."
11,1,"Now faith is confidence in what we hope for and assurance about what we do not see."
11,2,"This is what the ancients were commended for."
11,3,"By faith we understand that the universe was formed at God’s command, so that what is seen was not made out of what was visible."
11,4,"By faith Abel brought God a better offering than Cain did. By faith he was commended as righteous, when God spoke well of his offerings. And by faith Abel still speaks, even though he is dead."
11,5,"By faith Enoch was taken from this life, so that he did not experience death: “He could not be found, because God had taken him away.” For before he was taken, he was commended as one who pleased God."
11,6,"And without faith it is impossible to please God, because anyone who comes to him must believe that he exists and that he rewards those who earnestly seek him."
11,7,"By faith Noah, when warned about things not yet seen, in holy fear built an ark to save his family. By his faith he condemned the world and became heir of the righteousness that is in keeping with faith."
11,8,"By faith Abraham, when called to go to a place he would later receive as his inheritance, obeyed and went, even though he did not know where he was going."
11,9,"By faith he made his home in the promised land like a stranger in a foreign country; he lived in tents, as did Isaac and Jacob, who were heirs with him of the same promise."
11,10,"For he was looking forward to the city with foundations, whose architect and builder is God."
11,11,"And by faith even Sarah, who was past childbearing age, was enabled to bear children because she considered him faithful who had made the promise."
11,12,"And so from this one man, and he as good as dead, came descendants as numerous as the stars in the sky and as countless as the sand on the seashore."
11,13,"All these people were still living by faith when they died. They did not receive the things promised; they only saw them and welcomed them from a distance, admitting that they were foreigners and strangers on earth."
11,14,"People who say such things show that they are looking for a country of their own."
11,15,"If they had been thinking of the country they had left, they would have had opportunity to return."
11,16,"Instead, they were longing for a better country—a heavenly one. Therefore God is not ashamed to be called their God, for he has prepared a city for them."
11,17,"By faith Abraham, when God tested him, offered Isaac as a sacrifice. He who had embraced the promises was about to sacrifice his one and only son,"
11,18,"even though God had said to him, “It is through Isaac that your offspring will be reckoned.”"
11,19,"Abraham reasoned that God could even raise the dead, and so in a manner of speaking he did receive Isaac back from death."
11,20,"By faith Isaac blessed Jacob and Esau in regard to their future."
11,21,"By faith Jacob, when he was dying, blessed each of Joseph’s sons, and worshiped as he leaned on the top of his staff."
11,22,"By faith Joseph, when his end was near, spoke about the exodus of the Israelites from Egypt and gave instructions concerning the burial of his bones."
11,23,"By faith Moses’ parents hid him for three months after he was born, because they saw he was no ordinary child, and they were not afraid of the king’s edict."
11,24,"By faith Moses, when he had grown up, refused to be known as the son of Pharaoh’s daughter."
11,25,"He chose to be mistreated along with the people of God rather than to enjoy the fleeting pleasures of sin."
11,26,"He regarded disgrace for the sake of Christ as of greater value than the treasures of Egypt, because he was looking ahead to his reward."
11,27,"By faith he left Egypt, not fearing the king’s anger; he persevered because he saw him who is invisible."
11,28,"By faith he kept the Passover and the application of blood, so that the destroyer of the firstborn would not touch the firstborn of Israel."
11,29,"By faith the people passed through the Red Sea as on dry land; but when the Egyptians tried to do so, they were drowned."
11,30,"By faith the walls of Jericho fell, after the army had marched around them for seven days."
11,31,"By faith the prostitute Rahab, because she welcomed the spies, was not killed with those who were disobedient."
11,32,"And what more shall I say? I do not have time to tell about Gideon, Barak, Samson and Jephthah, about David and Samuel and the prophets,"
11,33,"who through faith conquered kingdoms, administered justice, and gained what was promised; who shut the mouths of lions,"
11,34,"quenched the fury of the flames, and escaped the edge of the sword; whose weakness was turned to strength; and who became powerful in battle and routed foreign armies."
11,35,"Women received back their dead, raised to life again. There were others who were tortured, refusing to be released so that they might gain an even better resurrection."
11,36,"Some faced jeers and flogging, and even chains and imprisonment."
11,37,"They were put to death by stoning; they were sawed in two; they were killed by the sword. They went about in sheepskins and goatskins, destitute, persecuted and mistreated—"
11,38,"the world was not worthy of them. They wandered in deserts and mountains, living in caves and in holes in the ground."
11,39,"These were all commended for their faith, yet none of them received what had been promised,"
11,40,"since God had planned something better for us so that only together with us would they be made perfect."
12,1,"Therefore, since we are surrounded by such a great cloud of witnesses, let us throw off everything that hinders and the sin that so easily entangles. And let us run with perseverance the race marked out for us,"
12,2,"fixing our eyes on Jesus, the pioneer and perfecter of faith. For the joy set before him he endured the cross, scorning its shame, and sat down at the right hand of the throne of God."
12,3,"Consider him who endured such opposition from sinners, so that you will not grow weary and lose heart."
12,4,"In your struggle against sin, you have not yet resisted to the point of shedding your blood."
12,5,"And have you completely forgotten this word of encouragement that addresses you as a father addresses his son? It says, “My son, do not make light of the Lord’s discipline, and do not lose heart when he rebukes you,"
12,6,"because the Lord disciplines the one he loves, and he chastens everyone he accepts as his son.”"
12,7,"Endure hardship as discipline; God is treating you as his children. For what children are not disciplined by their father?"
12,8,"If you are not disciplined—and everyone undergoes discipline—then you are not legitimate, not true sons and daughters at all."
12,9,"Moreover, we have all had human fathers who disciplined us and we respected them for it. How much more should we submit to the Father of spirits and live!"
12,10,"They disciplined us for a little while as they thought best; but God disciplines us for our good, in order that we may share in his holiness."
12,11,"No discipline seems pleasant at the time, but painful. Later on, however, it produces a harvest of righteousness and peace for those who have been trained by it."
12,12,"Therefore, strengthen your feeble arms and weak knees."
12,13,"“Make level paths for your feet,” so that the lame may not be disabled, but rather healed."
12,14,"Make every effort to live in peace with everyone and to be holy; without holiness no one will see the Lord."
12,15,"See to it that no one falls short of the grace of God and that no bitter root grows up to cause trouble and defile many."
12,16,"See that no one is sexually immoral, or is godless like Esau, who for a single meal sold his inheritance rights as the oldest son."
12,17,"Afterward, as you know, when he wanted to inherit this blessing, he was rejected. Even though he sought the blessing with tears, he could not change what he had done."
12,18,"You have not come to a mountain that can be touched and that is burning with fire; to darkness, gloom and storm;"
12,19,"to a trumpet blast or to such a voice speaking words that those who heard it begged that no further word be spoken to them,"
12,20,"because they could not bear what was commanded: “If even an animal touches the mountain, it must be stoned to death.”"
12,21,"The sight was so terrifying that Moses said, “I am trembling with fear.”"
12,22,"But you have come to Mount Zion, to the city of the living God, the heavenly Jerusalem. You have come to thousands upon thousands of angels in joyful assembly,"
12,23,"to the church of the firstborn, whose names are written in heaven. You have come to God, the Judge of all, to the spirits of the righteous made perfect,"
12,24,"to Jesus the mediator of a new covenant, and to the sprinkled blood that speaks a better word than the blood of Abel."
12,25,"See to it that you do not refuse him who speaks. If they did not escape when they refused him who warned them on earth, how much less will we, if we turn away from him who warns us from heaven?"
12,26,"At that time his voice shook the earth, but now he has promised, “Once more I will shake not only the earth but also the heavens.”"
12,27,"The words “once more” indicate the removing of what can be shaken—that is, created things—so that what cannot be shaken may remain."
12,28,"Therefore, since we are receiving a kingdom that cannot be shaken, let us be thankful, and so worship God acceptably with reverence and awe,"
12,29,"for our “God is a consuming fire.”"
13,1,"Keep on loving one another as brothers and sisters."
13,2,"Do not forget to show hospitality to strangers, for by so doing some people have shown hospitality to angels without knowing it."
13,3,"Continue to remember those in prison as if you were together with them in prison, and those who are mistreated as if you yourselves were suffering."
13,4,"Marriage should be honored by all, and the marriage bed kept pure, for God will judge the adulterer and all the sexually immoral."
13,5,"Keep your lives free from the love of money and be content with what you have, because God has said, “Never will I leave you; never will I forsake you.”"
13,6,"So we say with confidence, “The Lord is my helper; I will not be afraid. What can mere mortals do to me?”"
13,7,"Remember your leaders, who spoke the word of God to you. Consider the outcome of their way of life and imitate their faith."
13,8,"Jesus Christ is the same yesterday and today and forever."
13,9,"Do not be carried away by all kinds of strange teachings. It is good for our hearts to be strengthened by grace, not by eating ceremonial foods, which is of no benefit to those who do so."
13,10,"We have an altar from which those who minister at the tabernacle have no right to eat."
13,11,"The high priest carries the blood of animals into the Most Holy Place as a sin offering, but the bodies are burned outside the camp."
13,12,"And so Jesus also suffered outside the city gate to make the people holy through his own blood."
13,13,"Let us, then, go to him outside the camp, bearing the disgrace he bore."
13,14,"For here we do not have an enduring city, but we are looking for the city that is to come."
13,15,"Through Jesus, therefore, let us continually offer to God a sacrifice of praise—the fruit of lips that openly profess his name."
13,16,"And do not forget to do good and to share with others, for with such sacrifices God is pleased."
13,17,"Have confidence in your leaders and submit to their authority, because they keep watch over you as those who must give an account. Do this so that their work will be a joy, not a burden, for that would be of no benefit to you."
13,18,"Pray for us. We are sure that we have a clear conscience and desire to live honorably in every way."
13,19,"I particularly urge you to pray so that I may be restored to you soon."
13,20,"Now may the God of peace, who through the blood of the eternal covenant brought back from the dead our Lord Jesus, that great Shepherd of the sheep,"
13,21,"equip you with everything good for doing his will, and may he work in us what is pleasing to him, through Jesus Christ, to whom be glory for ever and ever. Amen."
13,22,"Brothers and sisters, I urge you to bear with my word of exhortation, for in fact I have written to you quite briefly."
13,23,"I want you to know that our brother Timothy has been released. If he arrives soon, I will come with him to see you."
13,24,"Greet all your leaders and all the Lord’s people. Those from Italy send you their greetings."
13,25,"Grace be with you all."
