1,1,"In the beginning was the Word, and the Word was with God, and the Word was God."
1,2,"He was with God in the beginning."
1,3,"Through him all things were made; without him nothing was made that has been made."
1,4,"In him was life, and that life was the light of all mankind."
1,5,"The light shines in the darkness, and the darkness has not overcome it."
1,6,"There was a man sent from God whose name was John."
1,7,"He came as a witness to testify concerning that light, so that through him all might believe."
1,8,"He himself was not the light; he came only as a witness to the light."
1,9,"The true light that gives light to everyone was coming into the world."
1,10,"He was in the world, and though the world was made through him, the world did not recognize him."
1,11,"He came to that which was his own, but his own did not receive him."
1,12,"Yet to all who did receive him, to those who believed in his name, he gave the right to become children of God—"
1,13,"children born not of natural descent, nor of human decision or a husband’s will, but born of God."
1,14,"The Word became flesh and made his dwelling among us. We have seen his glory, the glory of the one and only Son, who came from the Father, full of grace and truth."
1,15,"(John testified concerning him. He cried out, saying, “This is the one I spoke about when I said, ‘He who comes after me has surpassed me because he was before me.’”)"
1,16,"Out of his fullness we have all received grace in place of grace already given."
1,17,"For the law was given through Moses; grace and truth came through Jesus Christ."
1,18,"No one has ever seen God, but the one and only Son, who is himself God and is in closest relationship with the Father, has made him known."
1,19,"Now this was John’s testimony when the Jewish leaders in Jerusalem sent priests and Levites to ask him who he was."
1,20,"He did not fail to confess, but confessed freely, “I am not the Messiah.”"
1,21,"They asked him, “Then who are you? Are you Elijah?” He said, “I am not.” “Are you the Prophet?” He answered, “No.”"
1,22,"Finally they said, “Who are you? Give us an answer to take back to those who sent us. What do you say about yourself?”"
1,23,"John replied in the words of Isaiah the prophet, “I am the voice of one calling in the wilderness, ‘Make straight the way for the Lord.’”"
1,24,"Now the Pharisees who had been sent"
1,25,"questioned him, “Why then do you baptize if you are not the Messiah, nor Elijah, nor the Prophet?”"
1,26,"“I baptize with water,” John replied, “but among you stands one you do not know."
1,27,"He is the one who comes after me, the straps of whose sandals I am not worthy to untie.”"
1,28,"This all happened at Bethany on the other side of the Jordan, where John was baptizing."
1,29,"The next day John saw Jesus coming toward him and said, “Look, the Lamb of God, who takes away the sin of the world!"
1,30,"This is the one I meant when I said, ‘A man who comes after me has surpassed me because he was before me.’"
1,31,"I myself did not know him, but the reason I came baptizing with water was that he might be revealed to Israel.”"
1,32,"Then John gave this testimony: “I saw the Spirit come down from heaven as a dove and remain on him."
1,33,"And I myself did not know him, but the one who sent me to baptize with water told me, ‘The man on whom you see the Spirit come down and remain is the one who will baptize with the Holy Spirit.’"
1,34,"I have seen and I testify that this is God’s Chosen One.”"
1,35,"The next day John was there again with two of his disciples."
1,36,"When he saw Jesus passing by, he said, “Look, the Lamb of God!”"
1,37,"When the two disciples heard him say this, they followed Jesus."
1,38,"Turning around, Jesus saw them following and asked, “What do you want?” They said, “Rabbi” (which means “Teacher”), “where are you staying?”"
1,39,"“Come,” he replied, “and you will see.” So they went and saw where he was staying, and they spent that day with him. It was about four in the afternoon."
1,40,"Andrew, Simon Peter’s brother, was one of the two who heard what John had said and who had followed Jesus."
1,41,"The first thing Andrew did was to find his brother Simon and tell him, “We have found the Messiah” (that is, the Christ)."
1,42,"And he brought him to Jesus. Jesus looked at him and said, “You are Simon son of John. You will be called Cephas” (which, when translated, is Peter)."
1,43,"The next day Jesus decided to leave for Galilee. Finding Philip, he said to him, “Follow me.”"
1,44,"Philip, like Andrew and Peter, was from the town of Bethsaida."
1,45,"Philip found Nathanael and told him, “We have found the one Moses wrote about in the Law, and about whom the prophets also wrote—Jesus of Nazareth, the son of Joseph.”"
1,46,"“Nazareth! Can anything good come from there?” Nathanael asked. “Come and see,” said Philip."
1,47,"When Jesus saw Nathanael approaching, he said of him, “Here truly is an Israelite in whom there is no deceit.”"
1,48,"“How do you know me?” Nathanael asked. Jesus answered, “I saw you while you were still under the fig tree before Philip called you.”"
1,49,"Then Nathanael declared, “Rabbi, you are the Son of God; you are the king of Israel.”"
1,50,"Jesus said, “You believe because I told you I saw you under the fig tree. You will see greater things than that.”"
1,51,"He then added, “Very truly I tell you, you will see ‘heaven open, and the angels of God ascending and descending on’ the Son of Man.”"
2,1,"On the third day a wedding took place at Cana in Galilee. Jesus’ mother was there,"
2,2,"and Jesus and his disciples had also been invited to the wedding."
2,3,"When the wine was gone, Jesus’ mother said to him, “They have no more wine.”"
2,4,"“Woman, why do you involve me?” Jesus replied. “My hour has not yet come.”"
2,5,"His mother said to the servants, “Do whatever he tells you.”"
2,6,"Nearby stood six stone water jars, the kind used by the Jews for ceremonial washing, each holding from twenty to thirty gallons."
2,7,"Jesus said to the servants, “Fill the jars with water”; so they filled them to the brim."
2,8,"Then he told them, “Now draw some out and take it to the master of the banquet.” They did so,"
2,9,"and the master of the banquet tasted the water that had been turned into wine. He did not realize where it had come from, though the servants who had drawn the water knew. Then he called the bridegroom aside"
2,10,"and said, “Everyone brings out the choice wine first and then the cheaper wine after the guests have had too much to drink; but you have saved the best till now.”"
2,11,"What Jesus did here in Cana of Galilee was the first of the signs through which he revealed his glory; and his disciples believed in him."
2,12,"After this he went down to Capernaum with his mother and brothers and his disciples. There they stayed for a few days."
2,13,"When it was almost time for the Jewish Passover, Jesus went up to Jerusalem."
2,14,"In the temple courts he found people selling cattle, sheep and doves, and others sitting at tables exchanging money."
2,15,"So he made a whip out of cords, and drove all from the temple courts, both sheep and cattle; he scattered the coins of the money changers and overturned their tables."
2,16,"To those who sold doves he said, “Get these out of here! Stop turning my Father’s house into a market!”"
2,17,"His disciples remembered that it is written: “Zeal for your house will consume me.”"
2,18,"The Jews then responded to him, “What sign can you show us to prove your authority to do all this?”"
2,19,"Jesus answered them, “Destroy this temple, and I will raise it again in three days.”"
2,20,"They replied, “It has taken forty-six years to build this temple, and you are going to raise it in three days?”"
2,21,"But the temple he had spoken of was his body."
2,22,"After he was raised from the dead, his disciples recalled what he had said. Then they believed the scripture and the words that Jesus had spoken."
2,23,"Now while he was in Jerusalem at the Passover Festival, many people saw the signs he was performing and believed in his name."
2,24,"But Jesus would not entrust himself to them, for he knew all people."
2,25,"He did not need any testimony about mankind, for he knew what was in each person."
3,1,"Now there was a Pharisee, a man named Nicodemus who was a member of the Jewish ruling council."
3,2,"He came to Jesus at night and said, “Rabbi, we know that you are a teacher who has come from God. For no one could perform the signs you are doing if God were not with him.”"
3,3,"Jesus replied, “Very truly I tell you, no one can see the kingdom of God unless they are born again.”"
3,4,"“How can someone be born when they are old?” Nicodemus asked. “Surely they cannot enter a second time into their mother’s womb to be born!”"
3,5,"Jesus answered, “Very truly I tell you, no one can enter the kingdom of God unless they are born of water and the Spirit."
3,6,"Flesh gives birth to flesh, but the Spirit gives birth to spirit."
3,7,"You should not be surprised at my saying, ‘You must be born again.’"
3,8,"The wind blows wherever it pleases. You hear its sound, but you cannot tell where it comes from or where it is going. So it is with everyone born of the Spirit.”"
3,9,"“How can this be?” Nicodemus asked."
3,10,"“You are Israel’s teacher,” said Jesus, “and do you not understand these things?"
3,11,"Very truly I tell you, we speak of what we know, and we testify to what we have seen, but still you people do not accept our testimony."
3,12,"I have spoken to you of earthly things and you do not believe; how then will you believe if I speak of heavenly things?"
3,13,"No one has ever gone into heaven except the one who came from heaven—the Son of Man."
3,14,"Just as Moses lifted up the snake in the wilderness, so the Son of Man must be lifted up,"
3,15,"that everyone who believes may have eternal life in him.”"
3,16,"For God so loved the world that he gave his one and only Son, that whoever believes in him shall not perish but have eternal life."
3,17,"For God did not send his Son into the world to condemn the world, but to save the world through him."
3,18,"Whoever believes in him is not condemned, but whoever does not believe stands condemned already because they have not believed in the name of God’s one and only Son."
3,19,"This is the verdict: Light has come into the world, but people loved darkness instead of light because their deeds were evil."
3,20,"Everyone who does evil hates the light, and will not come into the light for fear that their deeds will be exposed."
3,21,"But whoever lives by the truth comes into the light, so that it may be seen plainly that what they have done has been done in the sight of God."
3,22,"After this, Jesus and his disciples went out into the Judean countryside, where he spent some time with them, and baptized."
3,23,"Now John also was baptizing at Aenon near Salim, because there was plenty of water, and people were coming and being baptized."
3,24,"(This was before John was put in prison.)"
3,25,"An argument developed between some of John’s disciples and a certain Jew over the matter of ceremonial washing."
3,26,"They came to John and said to him, “Rabbi, that man who was with you on the other side of the Jordan—the one you testified about—look, he is baptizing, and everyone is going to him.”"
3,27,"To this John replied, “A person can receive only what is given them from heaven."
3,28,"You yourselves can testify that I said, ‘I am not the Messiah but am sent ahead of him.’"
3,29,"The bride belongs to the bridegroom. The friend who attends the bridegroom waits and listens for him, and is full of joy when he hears the bridegroom’s voice. That joy is mine, and it is now complete."
3,30,"He must become greater; I must become less.”"
3,31,"The one who comes from above is above all; the one who is from the earth belongs to the earth, and speaks as one from the earth. The one who comes from heaven is above all."
3,32,"He testifies to what he has seen and heard, but no one accepts his testimony."
3,33,"Whoever has accepted it has certified that God is truthful."
3,34,"For the one whom God has sent speaks the words of God, for God gives the Spirit without limit."
3,35,"The Father loves the Son and has placed everything in his hands."
3,36,"Whoever believes in the Son has eternal life, but whoever rejects the Son will not see life, for God’s wrath remains on them."
4,1,"Now Jesus learned that the Pharisees had heard that he was gaining and baptizing more disciples than John—"
4,2,"although in fact it was not Jesus who baptized, but his disciples."
4,3,"So he left Judea and went back once more to Galilee."
4,4,"Now he had to go through Samaria."
4,5,"So he came to a town in Samaria called Sychar, near the plot of ground Jacob had given to his son Joseph."
4,6,"Jacob’s well was there, and Jesus, tired as he was from the journey, sat down by the well. It was about noon."
4,7,"When a Samaritan woman came to draw water, Jesus said to her, “Will you give me a drink?”"
4,8,"(His disciples had gone into the town to buy food.)"
4,9,"The Samaritan woman said to him, “You are a Jew and I am a Samaritan woman. How can you ask me for a drink?” (For Jews do not associate with Samaritans.)"
4,10,"Jesus answered her, “If you knew the gift of God and who it is that asks you for a drink, you would have asked him and he would have given you living water.”"
4,11,"“Sir,” the woman said, “you have nothing to draw with and the well is deep. Where can you get this living water?"
4,12,"Are you greater than our father Jacob, who gave us the well and drank from it himself, as did also his sons and his livestock?”"
4,13,"Jesus answered, “Everyone who drinks this water will be thirsty again,"
4,14,"but whoever drinks the water I give them will never thirst. Indeed, the water I give them will become in them a spring of water welling up to eternal life.”"
4,15,"The woman said to him, “Sir, give me this water so that I won’t get thirsty and have to keep coming here to draw water.”"
4,16,"He told her, “Go, call your husband and come back.”"
4,17,"“I have no husband,” she replied. Jesus said to her, “You are right when you say you have no husband."
4,18,"The fact is, you have had five husbands, and the man you now have is not your husband. What you have just said is quite true.”"
4,19,"“Sir,” the woman said, “I can see that you are a prophet."
4,20,"Our ancestors worshiped on this mountain, but you Jews claim that the place where we must worship is in Jerusalem.”"
4,21,"“Woman,” Jesus replied, “believe me, a time is coming when you will worship the Father neither on this mountain nor in Jerusalem."
4,22,"You Samaritans worship what you do not know; we worship what we do know, for salvation is from the Jews."
4,23,"Yet a time is coming and has now come when the true worshipers will worship the Father in the Spirit and in truth, for they are the kind of worshipers the Father seeks."
4,24,"God is spirit, and his worshipers must worship in the Spirit and in truth.”"
4,25,"The woman said, “I know that Messiah” (called Christ) “is coming. When he comes, he will explain everything to us.”"
4,26,"Then Jesus declared, “I, the one speaking to you—I am he.”"
4,27,"Just then his disciples returned and were surprised to find him talking with a woman. But no one asked, “What do you want?” or “Why are you talking with her?”"
4,28,"Then, leaving her water jar, the woman went back to the town and said to the people,"
4,29,"“Come, see a man who told me everything I ever did. Could this be the Messiah?”"
4,30,"They came out of the town and made their way toward him."
4,31,"Meanwhile his disciples urged him, “Rabbi, eat something.”"
4,32,"But he said to them, “I have food to eat that you know nothing about.”"
4,33,"Then his disciples said to each other, “Could someone have brought him food?”"
4,34,"“My food,” said Jesus, “is to do the will of him who sent me and to finish his work."
4,35,"Don’t you have a saying, ‘It’s still four months until harvest’? I tell you, open your eyes and look at the fields! They are ripe for harvest."
4,36,"Even now the one who reaps draws a wage and harvests a crop for eternal life, so that the sower and the reaper may be glad together."
4,37,"Thus the saying ‘One sows and another reaps’ is true."
4,38,"I sent you to reap what you have not worked for. Others have done the hard work, and you have reaped the benefits of their labor.”"
4,39,"Many of the Samaritans from that town believed in him because of the woman’s testimony, “He told me everything I ever did.”"
4,40,"So when the Samaritans came to him, they urged him to stay with them, and he stayed two days."
4,41,"And because of his words many more became believers."
4,42,"They said to the woman, “We no longer believe just because of what you said; now we have heard for ourselves, and we know that this man really is the Savior of the world.”"
4,43,"After the two days he left for Galilee."
4,44,"(Now Jesus himself had pointed out that a prophet has no honor in his own country.)"
4,45,"When he arrived in Galilee, the Galileans welcomed him. They had seen all that he had done in Jerusalem at the Passover Festival, for they also had been there."
4,46,"Once more he visited Cana in Galilee, where he had turned the water into wine. And there was a certain royal official whose son lay sick at Capernaum."
4,47,"When this man heard that Jesus had arrived in Galilee from Judea, he went to him and begged him to come and heal his son, who was close to death."
4,48,"“Unless you people see signs and wonders,” Jesus told him, “you will never believe.”"
4,49,"The royal official said, “Sir, come down before my child dies.”"
4,50,"“Go,” Jesus replied, “your son will live.” The man took Jesus at his word and departed."
4,51,"While he was still on the way, his servants met him with the news that his boy was living."
4,52,"When he inquired as to the time when his son got better, they said to him, “Yesterday, at one in the afternoon, the fever left him.”"
4,53,"Then the father realized that this was the exact time at which Jesus had said to him, “Your son will live.” So he and his whole household believed."
4,54,"This was the second sign Jesus performed after coming from Judea to Galilee."
5,1,"Some time later, Jesus went up to Jerusalem for one of the Jewish festivals."
5,2,"Now there is in Jerusalem near the Sheep Gate a pool, which in Aramaic is called Bethesda and which is surrounded by five covered colonnades."
5,3,"Here a great number of disabled people used to lie—the blind, the lame, the paralyzed. "
5,5,"One who was there had been an invalid for thirty-eight years."
5,6,"When Jesus saw him lying there and learned that he had been in this condition for a long time, he asked him, “Do you want to get well?”"
5,7,"“Sir,” the invalid replied, “I have no one to help me into the pool when the water is stirred. While I am trying to get in, someone else goes down ahead of me.”"
5,8,"Then Jesus said to him, “Get up! Pick up your mat and walk.”"
5,9,"At once the man was cured; he picked up his mat and walked. The day on which this took place was a Sabbath,"
5,10,"and so the Jewish leaders said to the man who had been healed, “It is the Sabbath; the law forbids you to carry your mat.”"
5,11,"But he replied, “The man who made me well said to me, ‘Pick up your mat and walk.’ ”"
5,12,"So they asked him, “Who is this fellow who told you to pick it up and walk?”"
5,13,"The man who was healed had no idea who it was, for Jesus had slipped away into the crowd that was there."
5,14,"Later Jesus found him at the temple and said to him, “See, you are well again. Stop sinning or something worse may happen to you.”"
5,15,"The man went away and told the Jewish leaders that it was Jesus who had made him well."
5,16,"So, because Jesus was doing these things on the Sabbath, the Jewish leaders began to persecute him."
5,17,"In his defense Jesus said to them, “My Father is always at his work to this very day, and I too am working.”"
5,18,"For this reason they tried all the more to kill him; not only was he breaking the Sabbath, but he was even calling God his own Father, making himself equal with God."
5,19,"Jesus gave them this answer: “Very truly I tell you, the Son can do nothing by himself; he can do only what he sees his Father doing, because whatever the Father does the Son also does."
5,20,"For the Father loves the Son and shows him all he does. Yes, and he will show him even greater works than these, so that you will be amazed."
5,21,"For just as the Father raises the dead and gives them life, even so the Son gives life to whom he is pleased to give it."
5,22,"Moreover, the Father judges no one, but has entrusted all judgment to the Son,"
5,23,"that all may honor the Son just as they honor the Father. Whoever does not honor the Son does not honor the Father, who sent him."
5,24,"“Very truly I tell you, whoever hears my word and believes him who sent me has eternal life and will not be judged but has crossed over from death to life."
5,25,"Very truly I tell you, a time is coming and has now come when the dead will hear the voice of the Son of God and those who hear will live."
5,26,"For as the Father has life in himself, so he has granted the Son also to have life in himself."
5,27,"And he has given him authority to judge because he is the Son of Man."
5,28,"“Do not be amazed at this, for a time is coming when all who are in their graves will hear his voice"
5,29,"and come out—those who have done what is good will rise to live, and those who have done what is evil will rise to be condemned."
5,30,"By myself I can do nothing; I judge only as I hear, and my judgment is just, for I seek not to please myself but him who sent me."
5,31,"“If I testify about myself, my testimony is not true."
5,32,"There is another who testifies in my favor, and I know that his testimony about me is true."
5,33,"“You have sent to John and he has testified to the truth."
5,34,"Not that I accept human testimony; but I mention it that you may be saved."
5,35,"John was a lamp that burned and gave light, and you chose for a time to enjoy his light."
5,36,"“I have testimony weightier than that of John. For the works that the Father has given me to finish—the very works that I am doing—testify that the Father has sent me."
5,37,"And the Father who sent me has himself testified concerning me. You have never heard his voice nor seen his form,"
5,38,"nor does his word dwell in you, for you do not believe the one he sent."
5,39,"You study the Scriptures diligently because you think that in them you have eternal life. These are the very Scriptures that testify about me,"
5,40,"yet you refuse to come to me to have life."
5,41,"“I do not accept glory from human beings,"
5,42,"but I know you. I know that you do not have the love of God in your hearts."
5,43,"I have come in my Father’s name, and you do not accept me; but if someone else comes in his own name, you will accept him."
5,44,"How can you believe since you accept glory from one another but do not seek the glory that comes from the only God?"
5,45,"“But do not think I will accuse you before the Father. Your accuser is Moses, on whom your hopes are set."
5,46,"If you believed Moses, you would believe me, for he wrote about me."
5,47,"But since you do not believe what he wrote, how are you going to believe what I say?”"
6,1,"Some time after this, Jesus crossed to the far shore of the Sea of Galilee (that is, the Sea of Tiberias),"
6,2,"and a great crowd of people followed him because they saw the signs he had performed by healing the sick."
6,3,"Then Jesus went up on a mountainside and sat down with his disciples."
6,4,"The Jewish Passover Festival was near."
6,5,"When Jesus looked up and saw a great crowd coming toward him, he said to Philip,“Where shall we buy bread for these people to eat?”"
6,6,"He asked this only to test him, for he already had in mind what he was going to do."
6,7,"Philip answered him, “It would take more than half a year’s wages to buy enough bread for each one to have a bite!”"
6,8,"Another of his disciples, Andrew, Simon Peter’s brother, spoke up,"
6,9,"“Here is a boy with five small barley loaves and two small fish, but how far will they go among so many?”"
6,10,"Jesus said, “Have the people sit down.” There was plenty of grass in that place, and they sat down (about five thousand men were there)."
6,11,"Jesus then took the loaves, gave thanks, and distributed to those who were seated as much as they wanted. He did the same with the fish."
6,12,"When they had all had enough to eat, he said to his disciples, “Gather the pieces that are left over. Let nothing be wasted.”"
6,13,"So they gathered them and filled twelve baskets with the pieces of the five barley loaves left over by those who had eaten."
6,14,"After the people saw the sign Jesus performed, they began to say, “Surely this is the Prophet who is to come into the world.”"
6,15,"Jesus, knowing that they intended to come and make him king by force, withdrew again to a mountain by himself."
6,16,"When evening came, his disciples went down to the lake,"
6,17,"where they got into a boat and set off across the lake for Capernaum. By now it was dark, and Jesus had not yet joined them."
6,18,"A strong wind was blowing and the waters grew rough."
